{
  "$schema": "../qualification-metadata-v1.schema.json",
  "schema_version": 1,
  "qualification_id": "state-space-v046",
  "qualification_kind": "state-space",
  "provenance": "POST_BASELINE",
  "baseline": "ADR-080",
  "version": 46,
  "artifacts": {
    "report": {
      "path": "state-space-audit-v46.md",
      "sha256": "d7c305b5adf6a56e579222e64562a9086585487557f4b036aa36ce4309546f53"
    },
    "executable": {
      "path": "state-space-audit-v46.py",
      "sha256": "661d9487a1b8dba91d45deeb837b3c635b1cedd3f97123a631ecec8e4aae2326"
    },
    "recorded_output": {
      "path": "state-space-audit-v46.txt",
      "sha256": "5853b0779896ccf0265fcf7d0b37c388188f3667445e013054a6b666dc586bbe"
    }
  },
  "supporting_artifacts": [
    {
      "path": "git-authoring-dependency-retention-smoke-v1.sh",
      "sha256": "b6127f3fe77910fd66859a219db91476fea2077a60498f10c13bf6f6d275d852"
    }
  ],
  "replay": {
    "runner": "python3",
    "expected_exit_code": 0,
    "stdout_sha256": "5853b0779896ccf0265fcf7d0b37c388188f3667445e013054a6b666dc586bbe"
  }
}
